{
  "schema": 0,
  "version": "2026.10.1",
  "periodic": {
    "daily": [
      {
        "key": "drive",
        "templates": {
          "daily-laps": {
            "objective": "laps",
            "tanks_ppm": 600000,
            "weight": 3,
            "reward_share": 2
          },
          "daily-laps-long": {
            "objective": "laps",
            "tanks_ppm": 900000,
            "weight": 1,
            "reward_share": 3
          }
        }
      },
      {
        "key": "earn",
        "templates": {
          "daily-cash": {
            "objective": "cash_earned",
            "tanks_ppm": 600000,
            "weight": 1,
            "reward_share": 2
          }
        }
      },
      {
        "key": "fuel",
        "templates": {
          "daily-fuel": {
            "objective": "fuel_spent",
            "tanks_ppm": 700000,
            "weight": 1,
            "reward_share": 1
          }
        }
      },
      {
        "key": "workshop",
        "templates": {
          "daily-mount": {
            "objective": "mount",
            "count": 1,
            "weight": 2,
            "reward_share": 1
          },
          "daily-upgrade": {
            "objective": "upgrade",
            "count": 1,
            "min_player_level": 10,
            "weight": 2,
            "reward_share": 1
          }
        }
      },
      {
        "key": "shop",
        "templates": {
          "daily-crate": {
            "objective": "crate",
            "count": 1,
            "weight": 2,
            "reward_share": 1
          },
          "daily-parts": {
            "objective": "parts_bought",
            "count": 1,
            "weight": 1,
            "reward_share": 1
          }
        }
      },
      {
        "key": "extra",
        "templates": {
          "daily-service": {
            "objective": "service",
            "count": 1,
            "items": [
              {
                "type": "crate",
                "kind": "slot"
              }
            ],
            "weight": 2,
            "reward_share": 2
          },
          "daily-laps-marathon": {
            "objective": "laps",
            "tanks_ppm": 1200000,
            "items": [
              {
                "type": "crate",
                "kind": "slot"
              }
            ],
            "weight": 1,
            "reward_share": 3
          }
        }
      }
    ],
    "weekly": [
      {
        "key": "drive",
        "templates": {
          "weekly-laps": {
            "objective": "laps",
            "tanks_ppm": 4000000,
            "weight": 1,
            "reward_share": 2
          }
        }
      },
      {
        "key": "earn",
        "templates": {
          "weekly-cash": {
            "objective": "cash_earned",
            "tanks_ppm": 4000000,
            "weight": 1,
            "reward_share": 2
          }
        }
      },
      {
        "key": "workshop",
        "templates": {
          "weekly-upgrade": {
            "objective": "upgrade",
            "count": 3,
            "min_player_level": 10,
            "weight": 2,
            "reward_share": 1
          },
          "weekly-mount": {
            "objective": "mount",
            "count": 3,
            "weight": 2,
            "reward_share": 1
          },
          "weekly-service": {
            "objective": "service",
            "count": 2,
            "weight": 1,
            "reward_share": 1
          }
        }
      },
      {
        "key": "shop",
        "templates": {
          "weekly-crate": {
            "objective": "crate",
            "count": 3,
            "items": [
              {
                "type": "crate",
                "kind": "mixed"
              }
            ],
            "weight": 2,
            "reward_share": 1
          },
          "weekly-parts": {
            "objective": "parts_bought",
            "count": 3,
            "items": [
              {
                "type": "crate",
                "kind": "mixed"
              }
            ],
            "weight": 1,
            "reward_share": 1
          }
        }
      },
      {
        "key": "world",
        "templates": {
          "weekly-journey": {
            "objective": "journey",
            "count": 2,
            "items": [
              {
                "type": "crate",
                "kind": "slot"
              }
            ],
            "weight": 2,
            "reward_share": 1
          },
          "weekly-rain": {
            "objective": "wet_laps",
            "tanks_ppm": 1500000,
            "items": [
              {
                "type": "crate",
                "kind": "slot"
              }
            ],
            "weight": 1,
            "reward_share": 1
          }
        }
      }
    ],
    "monthly": [
      {
        "key": "drive",
        "templates": {
          "monthly-laps": {
            "objective": "laps",
            "tanks_ppm": 20000000,
            "weight": 1,
            "reward_share": 2
          }
        }
      },
      {
        "key": "earn",
        "templates": {
          "monthly-cash": {
            "objective": "cash_earned",
            "tanks_ppm": 20000000,
            "weight": 1,
            "reward_share": 2
          }
        }
      },
      {
        "key": "workshop",
        "templates": {
          "monthly-upgrade": {
            "objective": "upgrade",
            "count": 10,
            "min_player_level": 10,
            "items": [
              {
                "type": "part",
                "rarity": "rare"
              }
            ],
            "weight": 2,
            "reward_share": 1
          },
          "monthly-service": {
            "objective": "service",
            "count": 6,
            "items": [
              {
                "type": "part",
                "rarity": "rare"
              }
            ],
            "weight": 1,
            "reward_share": 1
          },
          "monthly-mount": {
            "objective": "mount",
            "count": 8,
            "items": [
              {
                "type": "part",
                "rarity": "rare"
              }
            ],
            "weight": 1,
            "reward_share": 1
          }
        }
      },
      {
        "key": "world",
        "templates": {
          "monthly-journey": {
            "objective": "journey",
            "count": 8,
            "items": [
              {
                "type": "crate",
                "kind": "premium"
              }
            ],
            "weight": 2,
            "reward_share": 1
          },
          "monthly-crate": {
            "objective": "crate",
            "count": 12,
            "items": [
              {
                "type": "crate",
                "kind": "premium"
              }
            ],
            "weight": 2,
            "reward_share": 1
          }
        }
      }
    ]
  },
  "chains": [
    {
      "key": "driver",
      "title": {
        "en": "Driver",
        "pl": "Kierowca",
        "fr": "Pilote",
        "de": "Fahrer",
        "pt-BR": "Piloto"
      },
      "missions": [
        {
          "key": "driver-laps-50",
          "title": {
            "en": "The first 50 laps",
            "pl": "Pierwsze 50 okrążeń",
            "fr": "Les 50 premiers tours",
            "de": "Die ersten 50 Runden",
            "pt-BR": "As primeiras 50 voltas"
          },
          "text": {
            "en": "Drive 50 laps in all. Every car of yours counts.",
            "pl": "Przejedź razem 50 okrążeń. Liczą się wszystkie Twoje auta.",
            "fr": "Bouclez 50 tours en tout. Toutes vos voitures comptent.",
            "de": "Fahre insgesamt 50 Runden. Alle deine Autos zählen.",
            "pt-BR": "Dê 50 voltas no total. Todos os seus carros contam."
          },
          "objective": "laps",
          "count": 50,
          "reward": {
            "cash_tanks_ppm": 100000,
            "xp_tanks_ppm": 50000
          }
        },
        {
          "key": "driver-laps-250",
          "title": {
            "en": "Warming up",
            "pl": "Rozgrzewka",
            "fr": "Mise en route",
            "de": "Warmfahren",
            "pt-BR": "Aquecimento"
          },
          "text": {
            "en": "Drive 250 laps in all. The car is only warming up.",
            "pl": "Przejedź razem 250 okrążeń. Auto dopiero się rozgrzewa.",
            "fr": "Bouclez 250 tours en tout. La voiture ne fait que chauffer.",
            "de": "Fahre insgesamt 250 Runden. Das Auto wird gerade erst warm.",
            "pt-BR": "Dê 250 voltas no total. O carro está só esquentando."
          },
          "objective": "laps",
          "count": 250,
          "reward": {
            "cash_tanks_ppm": 150000,
            "xp_tanks_ppm": 80000,
            "items": [
              {
                "type": "crate",
                "kind": "slot"
              }
            ]
          }
        },
        {
          "key": "driver-level-10",
          "title": {
            "en": "Level ten",
            "pl": "Dziesiąty poziom",
            "fr": "Niveau dix",
            "de": "Stufe zehn",
            "pt-BR": "Nível dez"
          },
          "text": {
            "en": "Reach driver level 10. Levels open new tracks and parts.",
            "pl": "Dobij do 10. poziomu kierowcy. Poziomy otwierają nowe tory i części.",
            "fr": "Atteignez le niveau 10 de pilote. Les niveaux ouvrent de nouvelles pistes et pièces.",
            "de": "Erreiche Fahrerstufe 10. Stufen öffnen neue Strecken und Teile.",
            "pt-BR": "Chegue ao nível 10 de piloto. Os níveis abrem novas pistas e peças."
          },
          "objective": "player_level",
          "count": 10,
          "reward": {
            "cash_tanks_ppm": 200000,
            "xp_tanks_ppm": 100000
          }
        },
        {
          "key": "driver-cash-5k",